"Risk_ID,Risk_Title,Risk_Description,Risk_Category,Sub_Category,Sector,Department_Unit,Project_Name,Project_Code,Project_Phase,Process_Group,Risk_Owner,Stakeholder_Group,Date_Identified,Probability_Rating,Impact_Rating,Risk_Score,Qualitative_Notes,Quantitative_Notes,Mitigation_Strategy,Contingency_Plan,Risk_Status,Review_Date,Monitoring_Method,Control_Method,Documentation_Link,Lessons_Learned,Source_Type,Data_Quality_Flag,RMS_Step_Primary,RMS_Step_Identification,RMS_Step_Analysis_Qualitative,RMS_Step_Analysis_Quantitative,RMS_Step_Response_Planning,RMS_Step_Monitoring,RMS_Step_Controlling,RMS_Step_Documentation"
"CS093,Unsecured Dev CI Job History,Job history accessible without authentication,Cybersecurity,DevSecOps,Technology,Engineering,CIHistorySecure Program,CHS-2025,Execution,Monitoring,DevOps Lead,Engineering Team,2025-09-24,3,4,12,Job logs and history exposed publicly,Unauthorized access to build data,Restrict job history access and enforce auth,Purge public logs and notify team,Open,2025-10-01,CI Logs,Access Control Policy,https://cihistorysecure/docs/cs093,Audit job history access monthly,Internal Audit,Verified,Identification,Yes,Yes,Yes,Yes,Yes,Yes,Yes"
"CS094,Unsecured Dev CI Job Parameters,Sensitive parameters passed in plaintext,Cybersecurity,DevSecOps,Technology,Engineering,CIParamSecure Program,CPS-2025,Execution,Monitoring,DevOps Lead,Engineering Team,2025-09-24,3,4,12,Secrets passed via command-line args,Credential leakage risk,Use environment variables and secret vaults,Sanitize job configs and rotate secrets,Open,2025-10-01,CI Logs,Parameter Policy,https://ciparamsecure/docs/cs094,Train devs on secure job configs,Internal Audit,Verified,Identification,Yes,Yes,Yes,Yes,Yes,Yes,Yes"
"CS095,Unsecured Dev CI Job Scheduling,Jobs scheduled without approval,Cybersecurity,Change Management,Technology,Engineering,CIScheduleGuard Program,CSG-2025,Execution,Controlling,DevOps Lead,Engineering Team,2025-09-24,3,3,9,Jobs added without change request,No oversight of build triggers,Implement job scheduling approval workflow,Review job schedules and notify team,Open,2025-10-01,Schedule Logs,Change Control Policy,https://cischeduleguard/docs/cs095,Audit job schedules monthly,Internal Audit,Verified,Identification,Yes,Yes,Yes,Yes,Yes,Yes,Yes"
"CS096,Unsecured Dev CI Job Output,Output contains sensitive data,Cybersecurity,Monitoring Failure,Technology,Engineering,CIOutputSecure Program,COS-2025,Execution,Monitoring,DevOps Lead,Engineering Team,2025-09-24,3,4,12,Build logs include secrets and PII,Exposure of internal data,Sanitize output and mask sensitive fields,Purge logs and rotate credentials,Open,2025-10-01,Output Logs,Logging Policy,https://cioutputsecure/docs/cs096,Review job output templates monthly,Internal Audit,Verified,Identification,Yes,Yes,Yes,Yes,Yes,Yes,Yes"
"CS097,Unsecured Dev CI Job Retry,Jobs retried without validation,Cybersecurity,Change Management,Technology,Engineering,CIRetrySecure Program,CRS-2025,Execution,Controlling,DevOps Lead,Engineering Team,2025-09-24,3,3,9,Failed jobs retried without review,Potential for repeated errors,Implement retry approval and validation steps,Restrict retries and notify team,Open,2025-10-01,Retry Logs,Change Control Policy,https://ciretrysecure/docs/cs097,Audit retry logic monthly,Internal Audit,Verified,Identification,Yes,Yes,Yes,Yes,Yes,Yes,Yes"
"CS098,Unsecured Dev CI Job Cleanup,Artifacts and logs not purged post-build,Cybersecurity,DevSecOps,Technology,Engineering,CICleanup Program,CCP-2025,Execution,Monitoring,DevOps Lead,Engineering Team,2025-09-24,3,3,9,Old artifacts and logs retained indefinitely,Storage and exposure risk,Automate cleanup post-build and enforce retention,Purge residual data and notify team,Open,2025-10-01,Cleanup Logs,Retention Policy,https://cicleanup/docs/cs098,Review cleanup scripts monthly,Internal Audit,Verified,Identification,Yes,Yes,Yes,Yes,Yes,Yes,Yes"
"CS099,Unsecured Dev CI Job Approval,Jobs executed without stakeholder approval,Cybersecurity,Governance Risk,Technology,Engineering,CIApproval Program,CIA-2025,Execution,Controlling,DevOps Lead,Engineering Team,2025-09-24,3,3,9,No approval workflow for job execution,Uncontrolled code deployment risk,Implement stakeholder approval for critical jobs,Restrict job execution and notify stakeholders,Open,2025-10-01,Approval Logs,Governance Policy,https://ciapproval/docs/cs099,Audit approval workflows monthly,Internal Audit,Verified,Identification,Yes,Yes,Yes,Yes,Yes,Yes,Yes"
"CS100,Unsecured Dev CI Job Audit,Audit trail missing for job changes,Cybersecurity,Monitoring Failure,Technology,Engineering,CIAuditTrail Program,CAT-2025,Execution,Monitoring,DevOps Lead,Engineering Team,2025-09-24,3,3,9,No logs for job config changes,No accountability for modifications,Enable audit logging and change tracking,Configure audit trail and notify team,Open,2025-10-01,Audit Logs,Audit Trail Policy,https://ciaudittrail/docs/cs100,Review audit trail monthly,Internal Audit,Verified,Identification,Yes,Yes,Yes,Yes,Yes,Yes,Yes"
"CS101,Unsecured Dev CI Job Logs,Logs accessible without authentication,Cybersecurity,Monitoring Failure,Technology,Engineering,CILogAccess Program,CLA-2025,Execution,Monitoring,DevOps Lead,Engineering Team,2025-09-24,3,4,12,Logs exposed via public URLs,Unauthorized access to build history,Restrict log access and enforce authentication,Purge public logs and notify team,Open,2025-10-01,Log Files,Access Control Policy,https://cilogaccess/docs/cs101,Audit log access monthly,Internal Audit,Verified,Identification,Yes,Yes,Yes,Yes,Yes,Yes,Yes"
"CS102,Unsecured Dev CI Job Variables,Environment variables exposed in logs,Cybersecurity,Monitoring Failure,Technology,Engineering,CIVarSecure Program,CVS-2025,Execution,Monitoring,DevOps Lead,Engineering Team,2025-09-24,3,4,12,Secrets printed from env vars,Credential leakage risk,Mask sensitive variables and sanitize logs,Remove logs and rotate credentials,Open,2025-10-01,CI Logs,Environment Variable Policy,https://civarsecure/docs/cs102,Train devs on secure variable handling,Internal Audit,Verified,Identification,Yes,Yes,Yes,Yes,Yes,Yes,Yes"
"CS103,Unsecured Dev CI Job Configs,Configs stored without access controls,Cybersecurity,DevSecOps,Technology,Engineering,CIConfigSecure Program,CCS-2025,Execution,Monitoring,DevOps Lead,Engineering Team,2025-09-24,3,4,12,Config files contain secrets and tokens,Unauthorized access risk,Restrict config access and use secret vaults,Sanitize configs and rotate credentials,Open,2025-10-01,Config Logs,Config Access Policy,https://ciconfigsecure/docs/cs103,Audit config files monthly,Internal Audit,Verified,Identification,Yes,Yes,Yes,Yes,Yes,Yes,Yes"
"CS104,Unsecured Dev CI Job Metadata,Metadata reveals internal architecture,Cybersecurity,Monitoring Failure,Technology,Engineering,CIMetadataSecure Program,CMS-2025,Execution,Monitoring,DevOps Lead,Engineering Team,2025-09-24,3,3,9,Metadata includes internal IPs and paths,Exposure of infrastructure layout,Sanitize metadata and restrict access,Purge sensitive metadata and notify team,Open,2025-10-01,Metadata Logs,Metadata Policy,https://cimetadatasecure/docs/cs104,Review metadata exposure monthly,Internal Audit,Verified,Identification,Yes,Yes,Yes,Yes,Yes,Yes,Yes"
"CS105,Unsecured Dev CI Job Artifacts,Artifacts contain sensitive data,Cybersecurity,DevSecOps,Technology,Engineering,CIArtifactSecure Program,CAS-2025,Execution,Monitoring,DevOps Lead,Engineering Team,2025-09-24,3,4,12,Secrets embedded in build artifacts,Credential leakage risk,Scan artifacts for sensitive content,Purge affected artifacts and rotate secrets,Open,2025-10-01,Artifact Logs,Artifact Scanning Policy,https://ciartifactsecure/docs/cs105,Audit artifact contents monthly,Internal Audit,Verified,Identification,Yes,Yes,Yes,Yes,Yes,Yes,Yes"
"CS106,Unsecured Dev CI Job Execution,Jobs run without validation checks,Cybersecurity,Change Management,Technology,Engineering,CIExecSecure Program,CES-2025,Execution,Controlling,DevOps Lead,Engineering Team,2025-09-24,3,3,9,Jobs executed without code review,Uncontrolled deployment risk,Implement validation steps and approval workflow,Restrict job execution and notify team,Open,2025-10-01,Execution Logs,Execution Policy,https://ciexecsecure/docs/cs106,Audit job execution logic monthly,Internal Audit,Verified,Identification,Yes,Yes,Yes,Yes,Yes,Yes,Yes"
"CS107,Unsecured Dev CI Job Storage,Storage lacks encryption and access controls,Cybersecurity,Data Protection,Technology,Engineering,CIStorageSecure Program,CSS-2025,Execution,Monitoring,DevOps Lead,Engineering Team,2025-09-24,3,4,12,Artifacts stored in unencrypted volumes,Data leakage risk,Encrypt storage and enforce access policies,Re-encrypt and rotate credentials,Open,2025-10-01,Storage Logs,Storage Policy,https://cistoragesecure/docs/cs107,Audit storage configurations monthly,Internal Audit,Verified,Identification,Yes,Yes,Yes,Yes,Yes,Yes,Yes"
"CS108,Unsecured Dev CI Job Queue,Queue accessible without authentication,Cybersecurity,Application Security,Technology,Engineering,CIQueueSecure Program,CQS-2025,Execution,Monitoring,DevOps Lead,Engineering Team,2025-09-24,3,4,12,Queue exposed to public,Unauthorized job injection risk,Restrict queue access and enforce ACLs,Purge queue and rotate credentials,Open,2025-10-01,Queue Logs,Queue Access Policy,https://ciqueuesecure/docs/cs108,Audit job queue access monthly,Internal Audit,Verified,Identification,Yes,Yes,Yes,Yes,Yes,Yes,Yes"
"CS109,Unsecured Dev CI Job Scheduler,Scheduler lacks access controls,Cybersecurity,Application Security,Technology,Engineering,CISchedulerSecure Program,CSS-2025,Execution,Monitoring,DevOps Lead,Engineering Team,2025-09-24,3,4,12,Cron jobs editable by all users,Privilege escalation risk,Restrict scheduler access and enforce RBAC,Reconfigure scheduler and notify team,Open,2025-10-01,Scheduler Logs,Scheduler Policy,https://cischedulersecure/docs/cs109,Audit scheduler permissions monthly,Internal Audit,Verified,Identification,Yes,Yes,Yes,Yes,Yes,Yes,Yes"
"CS110,Unsecured Dev CI Job Trigger Logic,Trigger logic lacks validation,Cybersecurity,Application Security,Technology,Engineering,CITriggerLogicSecure Program,CTLS-2025,Execution,Monitoring,DevOps Lead,Engineering Team,2025-09-24,3,3,9,Jobs triggered by unverified conditions,Uncontrolled execution risk,Implement trigger validation and approval steps,Restrict triggers and notify team,Open,2025-10-01,Trigger Logs,Trigger Logic Policy,https://citriggerlogicsecure/docs/cs110,Audit trigger logic monthly,Internal Audit,Verified,Identification,Yes,Yes,Yes,Yes,Yes,Yes,Yes"
"CS111,Unsecured Dev CI Job Timeout,Jobs lack timeout configuration,Cybersecurity,Application Security,Technology,Engineering,CITimeoutSecure Program,CTS-2025,Execution,Monitoring,DevOps Lead,Engineering Team,2025-09-24,3,3,9,Jobs run indefinitely due to missing timeout,Resource exhaustion risk,Configure job timeouts and enforce limits,Terminate long-running jobs and notify team,Open,2025-10-01,CI Logs,Timeout Policy,https://citimeoutsecure/docs/cs111,Audit timeout settings monthly,Internal Audit,Verified,Identification,Yes,Yes,Yes,Yes,Yes,Yes,Yes"
"CS112,Unsecured Dev CI Job Dependencies,Dependencies lack version control,Cybersecurity,Application Security,Technology,Engineering,CIDepSecure Program,CDS-2025,Execution,Monitoring,DevOps Lead,Engineering Team,2025-09-24,3,4,12,Unpinned dependencies introduce instability,Exposure to breaking changes,Enforce version pinning and dependency scanning,Update dependency files and notify team,Open,2025-10-01,Dependency Logs,Dependency Policy,https://cidepsecure/docs/cs112,Review dependency versions monthly,Internal Audit,Verified,Identification,Yes,Yes,Yes,Yes,Yes,Yes,Yes"
"CS113,Unsecured Dev CI Job Rollback,No rollback plan for failed jobs,Cybersecurity,Change Management,Technology,Engineering,CIRollbackSecure Program,CRS-2025,Execution,Controlling,DevOps Lead,Engineering Team,2025-09-24,3,3,9,Failed deployments affect production,No recovery mechanism,Implement rollback scripts and approval workflow,Revert changes and notify stakeholders,Open,2025-10-01,Rollback Logs,Rollback Policy,https://cirollbacksecure/docs/cs113,Test rollback procedures monthly,Internal Audit,Verified,Identification,Yes,Yes,Yes,Yes,Yes,Yes,Yes"
"CS114,Unsecured Dev CI Job Notification Format,Notifications lack standardization,Cybersecurity,Communication Security,Technology,Engineering,CINotifyFormat Program,CNF-2025,Execution,Monitoring,DevOps Lead,Engineering Team,2025-09-24,3,3,9,Inconsistent notification formats confuse recipients,Delayed incident response,Standardize notification templates and channels,Update formats and train team,Open,2025-10-01,Notification Logs,Notification Format Policy,https://cinotifyformat/docs/cs114,Audit notification formats monthly,Internal Audit,Verified,Identification,Yes,Yes,Yes,Yes,Yes,Yes,Yes"
"CS115,Unsecured Dev CI Job Approval Trail,No record of job approvals,Cybersecurity,Governance Risk,Technology,Engineering,CIApprovalTrail Program,CAT-2025,Execution,Controlling,DevOps Lead,Engineering Team,2025-09-24,3,3,9,Approvals not logged or tracked,No accountability for job execution,Enable approval logging and retention,Configure audit trail and notify team,Open,2025-10-01,Approval Logs,Approval Policy,https://ciapprovaltrail/docs/cs115,Review approval records monthly,Internal Audit,Verified,Identification,Yes,Yes,Yes,Yes,Yes,Yes,Yes"
"CS116,Unsecured Dev CI Job Notification Delay,Notifications sent post-incident,Cybersecurity,Monitoring Failure,Technology,Engineering,CINotifyDelay Program,CND-2025,Execution,Monitoring,DevOps Lead,Engineering Team,2025-09-24,3,3,9,Alerts received after job failure,Delayed response and recovery,Configure real-time notifications and escalation paths,Test alert delivery and notify team,Open,2025-10-01,Notification Logs,Alert Timing Policy,https://cinotifydelay/docs/cs116,Audit notification latency monthly,Internal Audit,Verified,Identification,Yes,Yes,Yes,Yes,Yes,Yes,Yes"
"CS117,Unsecured Dev CI Job Retry Logic,Retry logic lacks validation checks,Cybersecurity,Change Management,Technology,Engineering,CIRetryLogic Program,CRL-2025,Execution,Controlling,DevOps Lead,Engineering Team,2025-09-24,3,3,9,Jobs retried without verifying root cause,Repeated failures and resource waste,Implement retry validation and approval steps,Restrict retries and notify team,Open,2025-10-01,Retry Logs,Retry Policy,https://ciretrylogic/docs/cs117,Audit retry logic monthly,Internal Audit,Verified,Identification,Yes,Yes,Yes,Yes,Yes,Yes,Yes"
"CS118,Unsecured Dev CI Job Notification Escalation,No escalation for failed jobs,Cybersecurity,Monitoring Failure,Technology,Engineering,CINotifyEscalation Program,CNE-2025,Execution,Monitoring,DevOps Lead,Engineering Team,2025-09-24,3,3,9,Failed jobs not escalated to stakeholders,Delayed incident resolution,Configure escalation paths and notification tiers,Update escalation matrix and notify team,Open,2025-10-01,Notification Logs,Escalation Policy,https://cinotifyescalation/docs/cs118,Review escalation logic monthly,Internal Audit,Verified,Identification,Yes,Yes,Yes,Yes,Yes,Yes,Yes"
"CS119,Unsecured Dev CI Job Notification Redundancy,Duplicate alerts flood channels,Cybersecurity,Communication Security,Technology,Engineering,CINotifyRedundancy Program,CNR-2025,Execution,Monitoring,DevOps Lead,Engineering Team,2025-09-24,3,2,6,Multiple alerts for same event,Alert fatigue and missed incidents,Deduplicate notifications and optimize alert logic,Update alert rules and notify team,Open,2025-10-01,Notification Logs,Alert Deduplication Policy,https://cinotifyredundancy/docs/cs119,Audit alert volume monthly,Internal Audit,Verified,Identification,Yes,Yes,Yes,Yes,Yes,Yes,Yes"
"CS120,Unsecured Dev CI Job Notification Routing,Alerts sent to wrong recipients,Cybersecurity,Communication Security,Technology,Engineering,CINotifyRouting Program,CNR-2025,Execution,Monitoring,DevOps Lead,Engineering Team,2025-09-24,3,3,9,Critical alerts missed due to misrouting,Delayed response and confusion,Configure routing rules and recipient mapping,Test routing logic and notify team,Open,2025-10-01,Notification Logs,Routing Policy,https://cinotifyrouting/docs/cs120,Audit alert routing monthly,Internal Audit,Verified,Identification,Yes,Yes,Yes,Yes,Yes,Yes,Yes"
"CS121,Unsecured Dev CI Job Notification Logging,Notifications not logged for audit,Cybersecurity,Monitoring Failure,Technology,Engineering,CINotifyLog Program,CNL-2025,Execution,Monitoring,DevOps Lead,Engineering Team,2025-09-24,3,3,9,No record of alerts sent,No traceability for incident response,Enable notification logging and retention,Configure logging and notify team,Open,2025-10-01,Notification Logs,Notification Logging Policy,https://cinotifylog/docs/cs121,Audit notification logs monthly,Internal Audit,Verified,Identification,Yes,Yes,Yes,Yes,Yes,Yes,Yes"
"CS122,Unsecured Dev CI Job Notification Permissions,All users can modify alert settings,Cybersecurity,Governance Risk,Technology,Engineering,CINotifyPerm Program,CNP-2025,Execution,Controlling,DevOps Lead,Engineering Team,2025-09-24,3,3,9,No role separation for alert configs,Privilege escalation risk,Restrict alert configuration access and enforce RBAC,Reassign roles and audit permissions,Open,2025-10-01,Access Logs,Alert Configuration Policy,https://cinotifyperm/docs/cs122,Audit alert permissions monthly,Internal Audit,Verified,Identification,Yes,Yes,Yes,Yes,Yes,Yes,Yes"
"CS123,Unsecured Dev CI Job Notification Templates,Templates lack standardization and validation,Cybersecurity,Communication Security,Technology,Engineering,CINotifyTemplate Program,CNT-2025,Execution,Monitoring,DevOps Lead,Engineering Team,2025-09-24,3,3,9,Templates include sensitive internal data,Exposure of system details,Standardize and sanitize notification templates,Update templates and notify team,Open,2025-10-01,Template Logs,Template Policy,https://cinotifytemplate/docs/cs123,Review templates monthly,Internal Audit,Verified,Identification,Yes,Yes,Yes,Yes,Yes,Yes,Yes"
"CS124,Unsecured Dev CI Job Notification Frequency,Alerts sent too frequently,Cybersecurity,Communication Security,Technology,Engineering,CINotifyFreq Program,CNF-2025,Execution,Monitoring,DevOps Lead,Engineering Team,2025-09-24,3,2,6,Alert fatigue due to excessive notifications,Missed critical alerts,Throttle alert frequency and prioritize severity,Update alert logic and notify team,Open,2025-10-01,Notification Logs,Alert Frequency Policy,https://cinotifyfreq/docs/cs124,Audit alert volume monthly,Internal Audit,Verified,Identification,Yes,Yes,Yes,Yes,Yes,Yes,Yes"
"CS125,Unsecured Dev CI Job Notification Channel Access,Public users can view alert channels,Cybersecurity,Communication Security,Technology,Engineering,CINotifyChannelAccess Program,CNCA-2025,Execution,Monitoring,DevOps Lead,Engineering Team,2025-09-24,3,4,12,Slack channels exposed to external users,Unauthorized access to alerts,Restrict channel access and enforce ACLs,Reconfigure channels and notify team,Open,2025-10-01,Channel Logs,Channel Access Policy,https://cinotifychannelaccess/docs/cs125,Audit channel access monthly,Internal Audit,Verified,Identification,Yes,Yes,Yes,Yes,Yes,Yes,Yes"
"CS126,Unsecured Dev CI Job Notification Content,Alerts include sensitive internal data,Cybersecurity,Communication Security,Technology,Engineering,CINotifyContent Program,CNC-2025,Execution,Monitoring,DevOps Lead,Engineering Team,2025-09-24,3,4,12,Internal URLs and credentials in alerts,Exposure of system architecture,Sanitize alert content and restrict fields,Update alert templates and notify team,Open,2025-10-01,Notification Logs,Alert Content Policy,https://cinotifycontent/docs/cs126,Audit alert content monthly,Internal Audit,Verified,Identification,Yes,Yes,Yes,Yes,Yes,Yes,Yes"
"CS127,Unsecured Dev CI Job Notification Format Validation,No validation for alert format,Cybersecurity,Communication Security,Technology,Engineering,CINotifyFormatValidation Program,CNFV-2025,Execution,Monitoring,DevOps Lead,Engineering Team,2025-09-24,3,3,9,Alerts fail to render correctly,Missed incidents due to formatting errors,Implement format validation and preview logic,Test templates and notify team,Open,2025-10-01,Notification Logs,Format Validation Policy,https://cinotifyformatvalidation/docs/cs127,Audit alert formatting monthly,Internal Audit,Verified,Identification,Yes,Yes,Yes,Yes,Yes,Yes,Yes"
"CS128,Unsecured Dev CI Job Notification Routing Logic,Routing logic lacks validation,Cybersecurity,Communication Security,Technology,Engineering,CINotifyRoutingLogic Program,CNRL-2025,Execution,Monitoring,DevOps Lead,Engineering Team,2025-09-24,3,3,9,Alerts routed to wrong teams,Delayed response and confusion,Validate routing logic and configure fallback paths,Update routing rules and notify team,Open,2025-10-01,Routing Logs,Routing Logic Policy,https://cinotifyroutinglogic/docs/cs128,Audit routing logic monthly,Internal Audit,Verified,Identification,Yes,Yes,Yes,Yes,Yes,Yes,Yes"
"CS129,Unsecured Dev CI Job Notification Escalation Logic,Escalation logic not enforced,Cybersecurity,Monitoring Failure,Technology,Engineering,CINotifyEscalationLogic Program,CNEL-2025,Execution,Monitoring,DevOps Lead,Engineering Team,2025-09-24,3,3,9,Critical alerts not escalated properly,Delayed incident resolution,Configure escalation logic and test workflows,Update escalation matrix and notify team,Open,2025-10-01,Escalation Logs,Escalation Logic Policy,https://cinotifyescalationlogic/docs/cs129,Audit escalation logic monthly,Internal Audit,Verified,Identification,Yes,Yes,Yes,Yes,Yes,Yes,Yes"
"CS130,Unsecured Dev CI Job Notification Delivery,Alerts fail to reach recipients,Cybersecurity,Monitoring Failure,Technology,Engineering,CINotifyDelivery Program,CND-2025,Execution,Monitoring,DevOps Lead,Engineering Team,2025-09-24,3,3,9,Delivery failures due to misconfigured endpoints,Missed incidents and delayed response,Monitor delivery status and configure retries,Fix endpoints and notify team,Open,2025-10-01,Delivery Logs,Delivery Policy,https://cinotifydelivery/docs/cs130,Audit delivery success rates monthly,Internal Audit,Verified,Identification,Yes,Yes,Yes,Yes,Yes,Yes,Yes"
"CS131,Unsecured Dev CI Job Notification Endpoint,Endpoints lack authentication,Cybersecurity,Application Security,Technology,Engineering,CINotifyEndpoint Program,CNEP-2025,Execution,Monitoring,DevOps Lead,Engineering Team,2025-09-24,3,4,12,Notification endpoints accessible publicly,Unauthorized alert injection risk,Enforce endpoint authentication and ACLs,Disable exposed endpoints and rotate keys,Open,2025-10-01,Endpoint Logs,Endpoint Access Policy,https://cinotifyendpoint/docs/cs131,Audit endpoint access monthly,Internal Audit,Verified,Identification,Yes,Yes,Yes,Yes,Yes,Yes,Yes"
"CS132,Unsecured Dev CI Job Notification Encryption,Alerts sent without encryption,Cybersecurity,Communication Security,Technology,Engineering,CINotifyEncryption Program,CNE-2025,Execution,Monitoring,DevOps Lead,Engineering Team,2025-09-24,3,4,12,Sensitive alerts intercepted in transit,Exposure of internal data,Enable TLS and encrypt notification payloads,Reconfigure endpoints and notify team,Open,2025-10-01,Notification Logs,Encryption Policy,https://cinotifyencryption/docs/cs132,Audit notification encryption monthly,Internal Audit,Verified,Identification,Yes,Yes,Yes,Yes,Yes,Yes,Yes"
"CS133,Unsecured Dev CI Job Notification Retry,Failed alerts not retried,Cybersecurity,Monitoring Failure,Technology,Engineering,CINotifyRetry Program,CNR-2025,Execution,Monitoring,DevOps Lead,Engineering Team,2025-09-24,3,3,9,Alert delivery failures go unaddressed,Missed incidents and delayed response,Configure retry logic and monitor delivery status,Test retry mechanism and notify team,Open,2025-10-01,Notification Logs,Retry Policy,https://cinotifyretry/docs/cs133,Audit retry success rates monthly,Internal Audit,Verified,Identification,Yes,Yes,Yes,Yes,Yes,Yes,Yes"
"CS134,Unsecured Dev CI Job Notification Queue,Queue lacks access controls,Cybersecurity,Application Security,Technology,Engineering,CINotifyQueue Program,CNQ-2025,Execution,Monitoring,DevOps Lead,Engineering Team,2025-09-24,3,4,12,Notification queue exposed to public,Unauthorized message injection risk,Restrict queue access and enforce ACLs,Purge queue and rotate credentials,Open,2025-10-01,Queue Logs,Queue Access Policy,https://cinotifyqueue/docs/cs134,Audit queue access monthly,Internal Audit,Verified,Identification,Yes,Yes,Yes,Yes,Yes,Yes,Yes"
"CS135,Unsecured Dev CI Job Notification Storage,Stored alerts lack encryption,Cybersecurity,Data Protection,Technology,Engineering,CINotifyStorage Program,CNS-2025,Execution,Monitoring,DevOps Lead,Engineering Team,2025-09-24,3,4,12,Alerts stored in plaintext volumes,Exposure of sensitive data,Encrypt storage and enforce access policies,Re-encrypt and rotate credentials,Open,2025-10-01,Storage Logs,Storage Policy,https://cinotifystorage/docs/cs135,Audit alert storage monthly,Internal Audit,Verified,Identification,Yes,Yes,Yes,Yes,Yes,Yes,Yes"
"CS136,Unsecured Dev CI Job Notification Archive,Archived alerts lack retention policy,Cybersecurity,Monitoring Failure,Technology,Engineering,CINotifyArchive Program,CNA-2025,Execution,Monitoring,DevOps Lead,Engineering Team,2025-09-24,3,3,9,Old alerts retained indefinitely,Storage and exposure risk,Enforce retention limits and purge schedule,Purge outdated alerts and notify team,Open,2025-10-01,Archive Logs,Retention Policy,https://cinotifyarchive/docs/cs136,Review archive retention monthly,Internal Audit,Verified,Identification,Yes,Yes,Yes,Yes,Yes,Yes,Yes"
